Sheet: Feuil1
F1: 1.7 | H1: N° département | I1: Département
B2: =IF(AND(RC[2],RC[3]),"Formulaire complet : sauvegarder avant envoi","Formulaire incomplet : ne pas sauvegarder") -> Formulaire complet : sauvegarder avant envoi | D2: =NOT(OR(ISBLANK(R[6]C[-1]),ISBLANK(R[7]C[-1]),ISBLANK(R[8]C[-1]),ISBLANK(R[9]C[-1]),ISBLANK(R[11]C[-1]),ISBLANK(R[12]C[-1]),ISBLANK(R[13]C[-1]),ISBLANK(R[14]C[-1]),ISBLANK(R[15]C[-1]))) -> 1 | E2: =AND(EXACT(R[6]C,""),EXACT(R[7]C,""),EXACT(R[8]C,""),EXACT(R[9]C,""),EXACT(R[11]C,""),EXACT(R[12]C,""),EXACT(R[13]C,""),EXACT(R[14]C,""),EXACT(R[15]C,""),EXACT(R[16]C,""),(EXACT(R[10]C,"Département Invalide")=FALSE)) -> 1 | H2: 01 | I2: Ain
H3: 02 | I3: Aisne
H4: 03 | I4: Allier
B5: Pôle emploi : Gestion des bilans de prestation | H5: 04 | I5: Alpes-de-Haute-Provence
H6: 05 | I6: Hautes-Alpes | J6: Validation Siret Mandataire
H7: 06 | I7: Alpes-Maritimes | J7: impairs | K7: pairs
B8: Siret Mandataire | C8: 78035020300011 | E8: =IF(R[7]C[9]=0,"","SIRET Invalide") ->  | H8: 07 | I8: Ardèche | J8: =VALUE(MID(TEXT(2*VALUE(MID(TEXT(RC[-7],"#0"),1,1)),"#0"),1,1))+IF(LEN(TEXT(2*VALUE(MID(TEXT(RC[-7],"#0"),1,1)),"#0"))=1,0,VALUE(MID(TEXT(2*VALUE(MID(TEXT(RC[-7],"#0"),1,1)),"#0"),2,1))) -> 5 | K8: =VALUE(MID(TEXT(RC[-8],"#0"),2,1)) -> 8
B9: Adresse mail (pour la gestion des retours) | C9: jeremy.passeron3@extelia.fr | E9: =IF(OR(ISERROR(SEARCH(".",RC[-2],2)),ISERROR(SEARCH("@",RC[-2],2))),"Email invalide","") ->  | H9: 08 | I9: Ardennes | J9: =VALUE(MID(TEXT(2*VALUE(MID(TEXT(R[-1]C[-7],"#0"),3,1)),"#0"),1,1))+IF(LEN(TEXT(2*VALUE(MID(TEXT(R[-1]C[-7],"#0"),3,1)),"#0"))=1,0,VALUE(MID(TEXT(2*VALUE(MID(TEXT(R[-1]C[-7],"#0"),3,1)),"#0"),2,1))) -> 0 | K9: =VALUE(MID(TEXT(R[-1]C[-8],"#0"),4,1)) -> 3
B10: N° Marché | C10: M0020 | E10: =IF(LEN(RC[-2])<>5,"Numéro Marché invalide","") ->  | H10: 09 | I10: Ariège | J10: =VALUE(MID(TEXT(2*VALUE(MID(TEXT(R[-2]C[-7],"#0"),5,1)),"#0"),1,1))+IF(LEN(TEXT(2*VALUE(MID(TEXT(R[-2]C[-7],"#0"),5,1)),"#0"))=1,0,VALUE(MID(TEXT(2*VALUE(MID(TEXT(R[-2]C[-7],"#0"),5,1)),"#0"),2,1))) -> 1 | K10: =VALUE(MID(TEXT(R[-2]C[-8],"#0"),6,1)) -> 0
B11: N° DE | C11: 7854698 | E11: =IF(LEN(RC[-2])<>7,"N° de DE invalide",IF(ISERROR(VALUE(RC[-2])),"N° de DE invalide","")) ->  | H11: 10 | I11: Aube | J11: =VALUE(MID(TEXT(2*VALUE(MID(TEXT(R[-3]C[-7],"#0"),7,1)),"#0"),1,1))+IF(LEN(TEXT(2*VALUE(MID(TEXT(R[-3]C[-7],"#0"),7,1)),"#0"))=1,0,VALUE(MID(TEXT(2*VALUE(MID(TEXT(R[-3]C[-7],"#0"),7,1)),"#0"),2,1))) -> 4 | K11: =VALUE(MID(TEXT(R[-3]C[-8],"#0"),8,1)) -> 0
B12: N° de département de résidence du DE | C12: 22 | E12: =IF(EXACT(R[7]C[-2],"Code erroné"),"Département Invalide",R[7]C[-2]) -> Côtes-du-Nord | H12: 11 | I12: Aude | J12: =VALUE(MID(TEXT(2*VALUE(MID(TEXT(R[-4]C[-7],"#0"),9,1)),"#0"),1,1))+IF(LEN(TEXT(2*VALUE(MID(TEXT(R[-4]C[-7],"#0"),9,1)),"#0"))=1,0,VALUE(MID(TEXT(2*VALUE(MID(TEXT(R[-4]C[-7],"#0"),9,1)),"#0"),2,1))) -> 6 | K12: =VALUE(MID(TEXT(R[-4]C[-8],"#0"),10,1)) -> 0
B13: Siret prestataire | C13: 77569338500400 | E13: =IF(R[14]C[9]=0,"","SIRET Invalide") ->  | H13: 12 | I13: Aveyron | J13: =VALUE(MID(TEXT(2*VALUE(MID(TEXT(R[-5]C[-7],"#0"),11,1)),"#0"),1,1))+IF(LEN(TEXT(2*VALUE(MID(TEXT(R[-5]C[-7],"#0"),11,1)),"#0"))=1,0,VALUE(MID(TEXT(2*VALUE(MID(TEXT(R[-5]C[-7],"#0"),11,1)),"#0"),2,1))) -> 0 | K13: =VALUE(MID(TEXT(R[-5]C[-8],"#0"),12,1)) -> 0
B14: N° LC | C14: 65321 | E14: =IF(LEN(RC[-2])<>5,"N° LC invalide","") ->  | H14: 13 | I14: Bouches-du-Rhône | J14: =VALUE(MID(TEXT(2*VALUE(MID(TEXT(R[-6]C[-7],"#0"),13,1)),"#0"),1,1))+IF(LEN(TEXT(2*VALUE(MID(TEXT(R[-6]C[-7],"#0"),13,1)),"#0"))=1,0,VALUE(MID(TEXT(2*VALUE(MID(TEXT(R[-6]C[-7],"#0"),13,1)),"#0"),2,1))) -> 2 | K14: =VALUE(MID(TEXT(R[-6]C[-8],"#0"),14,1)) -> 1 | L14: sommes | M14: resultat | N14: final
B15: Date de démarrage | C15: 2010-03-12T00:00:00.000 | H15: 14 | I15: Calvados | J15: =SUM(R[-7]C:R[-1]C) -> 18 | K15: =SUM(R[-7]C:R[-1]C) -> 12 | L15: =SUM(RC[-2]:RC[-1]) -> 30 | M15: =MOD(RC[-1],10) -> 0 | N15: =IF(LEN(R[-7]C[-11])=14,RC[-1],"14 car pour un SIRET") -> 0
B16: Code Agence | C16: 65321 | E16: =IF(LEN(RC[-2])<>5,"Code Agence invalide",IF(ISERROR(VALUE(RC[-2])),"Code Agence invalide","")) ->  | H16: 15 | I16: Cantal
B17: Type de prestation | C17: CIBLE | H17: 16 | I17: Charente
B18: Date éventuelle d'abandon | E18: =IF(OR(LEN(RC[-2])=0,YEAR(RC[-2])>2005),"","Date invalide") ->  | H18: 17 | I18: Charente-Maritime | J18: Validation Siret prestataire
C19: =IF(ISNA(VLOOKUP(R[-7]C,R2C8:R102C9,2,FALSE)),"Code erroné",VLOOKUP(R[-7]C,R2C8:R102C9,2,FALSE)) -> Côtes-du-Nord | H19: 18 | I19: Cher | J19: impairs | K19: pairs
H20: 19 | I20: Corrèze | J20: =VALUE(MID(TEXT(2*VALUE(MID(TEXT(R[-7]C[-7],"#0"),1,1)),"#0"),1,1))+IF(LEN(TEXT(2*VALUE(MID(TEXT(R[-7]C[-7],"#0"),1,1)),"#0"))=1,0,VALUE(MID(TEXT(2*VALUE(MID(TEXT(R[-7]C[-7],"#0"),1,1)),"#0"),2,1))) -> 5 | K20: =VALUE(MID(TEXT(R[-7]C[-8],"#0"),2,1)) -> 7
A21: Version 2.0 | H21: 2A | I21: Corse-du-sud | J21: =VALUE(MID(TEXT(2*VALUE(MID(TEXT(R[-8]C[-7],"#0"),3,1)),"#0"),1,1))+IF(LEN(TEXT(2*VALUE(MID(TEXT(R[-8]C[-7],"#0"),3,1)),"#0"))=1,0,VALUE(MID(TEXT(2*VALUE(MID(TEXT(R[-8]C[-7],"#0"),3,1)),"#0"),2,1))) -> 1 | K21: =VALUE(MID(TEXT(R[-8]C[-8],"#0"),4,1)) -> 6
H22: 2B | I22: Haute-Corse | J22: =VALUE(MID(TEXT(2*VALUE(MID(TEXT(R[-9]C[-7],"#0"),5,1)),"#0"),1,1))+IF(LEN(TEXT(2*VALUE(MID(TEXT(R[-9]C[-7],"#0"),5,1)),"#0"))=1,0,VALUE(MID(TEXT(2*VALUE(MID(TEXT(R[-9]C[-7],"#0"),5,1)),"#0"),2,1))) -> 9 | K22: =VALUE(MID(TEXT(R[-9]C[-8],"#0"),6,1)) -> 3
H23: 21 | I23: Côte-d’Or | J23: =VALUE(MID(TEXT(2*VALUE(MID(TEXT(R[-10]C[-7],"#0"),7,1)),"#0"),1,1))+IF(LEN(TEXT(2*VALUE(MID(TEXT(R[-10]C[-7],"#0"),7,1)),"#0"))=1,0,VALUE(MID(TEXT(2*VALUE(MID(TEXT(R[-10]C[-7],"#0"),7,1)),"#0"),2,1))) -> 6 | K23: =VALUE(MID(TEXT(R[-10]C[-8],"#0"),8,1)) -> 8
H24: 22 | I24: Côtes-du-Nord | J24: =VALUE(MID(TEXT(2*VALUE(MID(TEXT(R[-11]C[-7],"#0"),9,1)),"#0"),1,1))+IF(LEN(TEXT(2*VALUE(MID(TEXT(R[-11]C[-7],"#0"),9,1)),"#0"))=1,0,VALUE(MID(TEXT(2*VALUE(MID(TEXT(R[-11]C[-7],"#0"),9,1)),"#0"),2,1))) -> 1 | K24: =VALUE(MID(TEXT(R[-11]C[-8],"#0"),10,1)) -> 0
H25: 23 | I25: Creuse | J25: =VALUE(MID(TEXT(2*VALUE(MID(TEXT(R[-12]C[-7],"#0"),11,1)),"#0"),1,1))+IF(LEN(TEXT(2*VALUE(MID(TEXT(R[-12]C[-7],"#0"),11,1)),"#0"))=1,0,VALUE(MID(TEXT(2*VALUE(MID(TEXT(R[-12]C[-7],"#0"),11,1)),"#0"),2,1))) -> 0 | K25: =VALUE(MID(TEXT(R[-12]C[-8],"#0"),12,1)) -> 4
H26: 24 | I26: Dordogne | J26: =VALUE(MID(TEXT(2*VALUE(MID(TEXT(R[-13]C[-7],"#0"),13,1)),"#0"),1,1))+IF(LEN(TEXT(2*VALUE(MID(TEXT(R[-13]C[-7],"#0"),13,1)),"#0"))=1,0,VALUE(MID(TEXT(2*VALUE(MID(TEXT(R[-13]C[-7],"#0"),13,1)),"#0"),2,1))) -> 0 | K26: =VALUE(MID(TEXT(R[-13]C[-8],"#0"),14,1)) -> 0 | L26: sommes | M26: resultat | N26: final
H27: 25 | I27: Doubs | J27: =SUM(R[-7]C:R[-1]C) -> 22 | K27: =SUM(R[-7]C:R[-1]C) -> 28 | L27: =SUM(RC[-2]:RC[-1]) -> 50 | M27: =MOD(RC[-1],10) -> 0 | N27: =IF(LEN(R[-14]C[-11])=14,RC[-1],"14 car pour un SIRET") -> 0
H28: 26 | I28: Drôme
H29: 27 | I29: Eure
H30: 28 | I30: Eure-et-Loir
H31: 29 | I31: Finistère
H32: 30 | I32: Gard
H33: 31 | I33: Haute-Garonne
H34: 32 | I34: Gers
H35: 33 | I35: Gironde
H36: 34 | I36: Hérault
H37: 35 | I37: Ille-et-Vilaine
H38: 36 | I38: Indre
H39: 37 | I39: Indre-et-Loire
H40: 38 | I40: Isère
H41: 39 | I41: Jura
H42: 40 | I42: Landes
H43: 41 | I43: Loir-et-Cher
H44: 42 | I44: Loire
H45: 43 | I45: Haute-Loire
H46: 44 | I46: Loire-Atlantique
H47: 45 | I47: Loiret
H48: 46 | I48: Lot
H49: 47 | I49: Lot-et-Garonne
H50: 48 | I50: Lozère
H51: 49 | I51: Maine-et-Loire
H52: 50 | I52: Manche
H53: 51 | I53: Marne
H54: 52 | I54: Haute-Marne
H55: 53 | I55: Mayenne
H56: 54 | I56: Meurthe-et-Moselle
H57: 55 | I57: Meuse
H58: 56 | I58: Morbihan
H59: 57 | I59: Moselle
H60: 58 | I60: Nièvre
H61: 59 | I61: Nord
H62: 60 | I62: Oise
H63: 61 | I63: Orne
H64: 62 | I64: Pas-de-Calais
H65: 63 | I65: Puy-de-Dôme
H66: 64 | I66: Pyrénées-Atlantiques
H67: 65 | I67: Hautes-Pyrénées
H68: 66 | I68: Pyrénées-Orientales
H69: 67 | I69: Bas-Rhin
H70: 68 | I70: Haut-Rhin
H71: 69 | I71: Rhône
H72: 70 | I72: Haute-Saône
H73: 71 | I73: Saône-et-Loire
H74: 72 | I74: Sarthe
H75: 73 | I75: Savoie
H76: 74 | I76: Haute-Savoie
H77: 75 | I77: Paris
H78: 76 | I78: Seine-Maritime
H79: 77 | I79: Seine-et-Marne
H80: 78 | I80: Yvelines
H81: 79 | I81: Deux-Sèvres
H82: 80 | I82: Somme
H83: 81 | I83: Tarn
H84: 82 | I84: Tarn-et-Garonne
H85: 83 | I85: Var
H86: 84 | I86: Vaucluse
H87: 85 | I87: Vendée
H88: 86 | I88: Vienne
H89: 87 | I89: Haute-Vienne
H90: 88 | I90: Vosges
H91: 89 | I91: Yonne
H92: 90 | I92: Territoire-de-Belfort
H93: 91 | I93: Essonne
H94: 92 | I94: Hauts-de-Seine
H95: 93 | I95: Seine-St-Denis
H96: 94 | I96: Val-de-Marne
H97: 95 | I97: Val-d’Oise
H98: 971 | I98: Guadeloupe
H99: 972 | I99: Martinique
H100: 973 | I100: Guyane
H101: 974 | I101: Réunion
H102: 975 | I102: Saint-Pierre-et-Miquelon